|track_id|track_name|track_rating|track_url|lyrics|genre|artist_name|artist_id|album_name|album_id
26|16460984|Titanium (extended)|74|https://www.musixmatch.com/lyrics/David-Guetta-5/Titanium-extended?utm_source=application&utm_campaign=api&utm_medium=University+of+Maryland%3A1409618655617| you shout it out but i can't hear a word you say i'm talking loud, not saying much  i'm criticized, but all your bullets ricochet shoot me down, but i get up  i'm bulletproof, nothing to lose fire away, fire away ricochet, you take your aim fire away, fire away  you shoot me down, but i won't fall i am titanium you shoot me down, but i won't fall i am titanium  cut me down but it's you who'll have further to fall ghost town and haunted love  raise your voice sticks and stones may break my bones talking loud, not saying much  i'm bulletproof, nothing to lose fire away, fire away ricochet, you take your aim fire away, fire away  you shoot me down, but i won't fall i am titanium you shoot me down, but i won't fall i am titanium  i am titanium i am titanium  you shoot me down, but i won't fall i am titanium you shoot me down, but i won't fall i am titanium you shoot me down, but i won't fall i am titanium you shoot me down, but i won't fall i am titanium  i am titanium|Dance|David Guetta feat. Sia|13791846|Titanium|13966831
27|37259014|E-Pro (Remix By Homelife)|74|https://www.musixmatch.com/lyrics/Beck/E-Pro-Remix-By-Homelife?utm_source=application&utm_campaign=api&utm_medium=University+of+Maryland%3A1409618655617| see me comin' to town with my soul straight down out of the world with my fingers holdin' onto the devil i know all my troubles i'll hang on your trigger take your eyes and your mind from the road shoot your mouth if you know where you're aimin' don't forget to pick up what you sow talkin' trash to the garbage around you  see me kickin' the door with my boots broke down out in a ditch of old rubbish snakes and bones in the back of your room handin' out a confection of venom  heaven's drunk from the poison you use charm the wolves with the eyes of a gambler now i see it's a comfort to you hammer my bones on the anvil of daylight  i won't give up that ghost it's sick the way these tongues are twisted the good in us is all we know there's too much left to taste that's bitter i won't give up that ghost it's sick the way these tongues are twisted the good in us is all we know there's too much left to taste that's bitter|Alternative|Beck|34|Guerolito|15729548
28|41978582|Dari Jauh Ku Pohon Maaf|73|https://www.musixmatch.com/lyrics/Sudirman/Dari-Jauh-Ku-Pohon-Maaf/translation/english?utm_source=application&utm_campaign=api&utm_medium=University+of+Maryland%3A1409618655617| in the cold dawn touched my heart recalls the fate of themsleves in regional the festive sound echoed tears falls imagine the atmosphere of picturesque villages miss of heart calling me back towards father mother and relatives but i have to make a living defending our common fate korus my only prayer and submission to convey sincere i beg forgiveness from afar do not sad this morning we are not together celebrating the honourable aidil fitr father's mother's blessing are always expected until i return to you korus my only prayer and submission to convey sincere i beg forgiveness from afar do not sad this morning we are not together celebrating the honourable aidil fitr father's mother's blessing are always expected for the sake of your child that is now away|World|Sudirman|24743146|Dari Jauh Ku Pohon Maaf|16023106
29|186978122|Wish|73|https://www.musixmatch.com/lyrics/Arashi/Wish/translation/english?utm_source=application&utm_campaign=api&utm_medium=University+of+Maryland%3A1409618655617| 街に愛の歌 流れはじめたら 人々は 寄り添い合う 輝きの中へ 僕は君をきっと 連れて行ってみせるよ  恋は届かない時を経験するうちに 強くなって ゆくものだね 切ない胸さえ 君に似合いの男になるまでこの僕に 振り向いてはくれないみたい 手厳しい君さ 過ぎてく季節を美しいと思えるこの頃 君がそこにいるからだと知ったのさ 今こそ 伝えよう  街に愛の歌 流れはじめたら 人々は 寄り添い合う 輝きの中へ 僕は君をきっと 連れて行ってみせるよ  やさしい男になろうと 試みてみたけど 君はそんな僕じゃ まるで 物足りないんだね 風当たり強い坂道ものぼって行けばいい 二人で生きてゆけるなら僕が君を守る 誓おう  街に愛の歌 流れはじめたら 人々は 微笑み合う 鐘の音響く時 僕は君をきっと 強く 抱きしめている  街に愛の歌 流れはじめたら 人々は 愛を語る 輝きの中へ 僕は君をきっと 連れて行ってみせるよ 君を愛し続ける|Pop|嵐|41026085|Wish - Single|35618815
30|16860396|Turn Me On|72|https://www.musixmatch.com/lyrics/David-Guetta-feat-Nicki-Minaj/Turn-Me-On?utm_source=application&utm_campaign=api&utm_medium=University+of+Maryland%3A1409618655617| doctor, doctor need you back home, baby doctor, doctor, where you at? give me somethin'  i need your love i need your love i need your lovin' you got that kind of medicine that keep me comin'  my body needs a hero come and save me something tells me you know how to save me i've been feeling weird, oh oh, i need you to come and rescue me  oooh-oh-oooh-oh-oooh-oh-oooh  make me come alive come on and turn me on touch me, save my life come on and turn me on i'm too young to die come on and turn me on turn me on, turn me on turn me on, turn me on  make me come alive come on and turn me on touch me, save my life come on and turn me on i'm too young to die come on and turn me on turn me on, turn me on turn me on, turn me on turn me on  oh, you make it, make it right my temperature is super high if i scream, if i cry it's only 'cause i feel alive  my body needs a hero come and save me something tells me you know how to save me i've been feeling weird, oh oh, i need you to come and rescue me oooh-oh-oooh-oh-oooh-oh-oooh  make me come alive come on and turn me on touch me, save my life come on and turn me on i'm too young to die come on and turn me on turn me on, turn me on turn me on, turn me on  make me come alive come on and turn me on touch me, save my life come on and turn me on i'm too young to die come on and turn me on turn me on, turn me on turn me on, turn me on  you've got my life in the palm of your hands palm of your hands come and save me now i know you can i know you can, uh, uh  dat-dat-dat-dat, don't let me die young i just want you to father my young i just want you to be my doctor we could get it crackin', chiropractor  i, i, i, i, i, i, i, i, i i kn-, i-i-i, i know you can save me and make me feel alive  make me come alive come on and turn me on touch me, save my life come on and turn me on i'm too young to die come on and turn me on turn me on, turn me on turn me on, turn me on|Dance|David Guetta feat. Nicki Minaj|13791839|Turn Me On|13948977
31|30761260|Just Hold Me|71|https://www.musixmatch.com/lyrics/Maria-Mena/Just-Hold-Me?utm_source=application&utm_campaign=api&utm_medium=University+of+Maryland%3A1409618655617| comfortable as i am i need your reassurance comfortable as you are you count the days  but if i wanted silence i would whisper and if i wanted loneliness i'd choose to go and if i liked rejection i'd audition and if i didn't love you, you would know  and why can't you just hold me and how come it is so hard? and do you like to see me broken? and why do i still care?  still care  you say you see the light now at the end of this narrow hall  and i wish it didn't matter i wish i didn't give you all but if i wanted silence i would whisper and if i wanted loneliness i'd choose to go  and if i liked rejection i'd audition and if i didn't love you, you would know and why can't you just hold me and how come it is so hard?  and do you like to see me broken? and why do i still care? poor little misunderstood baby no one likes a sad face but i can't remember life without him i think i did have good days i think i did have good days and why can't you just hold me and how come it is so hard? and do you like to see me broken? and why do i still care?|Pop|María Mena|18762|Apparently Unaffected|10583683
32|6760525|Everlasting Bomb|71|https://www.musixmatch.com/lyrics/Widescreen-Mode/Everlasting-Bomb?utm_source=application&utm_campaign=api&utm_medium=University+of+Maryland%3A1409618655617| above muslims above christians above jews above everything and everyone  ready to steam you ready to burn you ready to kill everything away  waiting for weakness waiting for anger waiting for a reason to become a god  going to use you going to break you, make you pull the trigger  almighty and everlasting bomb came down among us to make heaven of earth  almighty and everlasting bomb came down among us to make heaven of earth  killing for the nation killing for the nation killing for the nation killing for the na  killing for the nation killing for the family killing for religion killing for any reason anywhere  taking care of children taking care of parents everything burns just the same  no need to regret no need to pray the bomb will love you anyway  goal is destruction goal is extinction, bloodshed in the name of god  almighty and everlasting bomb came down among us to make heaven of earth  almighty and everlasting bomb came down among us to make heaven of earth  almighty and everlasting bomb came down among us to make heaven of earth  almighty and everlasting bomb came down among us to make heaven of earth  above human above human above human above human above human above human above human above human  above muslims above christians above jews above human  almighty and everlasting bomb almighty  almighty and everlasting bomb came down among us to make heaven of earth  almighty and everlasting bomb came down among us to make heaven of earth  almighty and everlasting bomb came down among us to make heaven of earth  almighty and everlasting bomb came down among us to make heaven of earth|Pop|Widescreen Mode|178331|Until the End|10794246
33|155434398|See|71|https://www.musixmatch.com/lyrics/HHP-4/See?utm_source=application&utm_campaign=api&utm_medium=University+of+Maryland%3A1409618655617||Hip Hop/Rap|HHP|36561806|YBA 2 NW|29696698
34|7469753|Beautiful|10|https://www.musixmatch.com/lyrics/The-Parlotones/Beautiful?utm_source=application&utm_campaign=api&utm_medium=University+of+Maryland%3A1409618655617| wish upon a falling star the passion patrol accept us for who we are we've gone and lost control, oh no  the outline of miracle required to be traced eliminate the need for thrills we all need to be saved today  and you are all beautiful and you are all magical deserve to be adored deserve to be adored  the science of all of this is a parodied poem avoid it with swinging fists don't want to be alone, oh no  there's romance in bitterness, say the borderline patrol, differentiate happiness, the borderline patrol  and you are all beautiful and you are all magical deserve to be adored deserve to be adored  i tell you for free this is just formula this is just chemistry none of this is real to me  and you are all beautiful and you are all magical deserve to be adored deserve to be adored|Alternative|The Parlotones|147856|Radiocontrolledrobot|10863604
35|87370004|Santa Baby - Non-LP Version|71|https://www.musixmatch.com/lyrics/Pussycat-Dolls/Santa-Baby-Non-LP-Version?utm_source=application&utm_campaign=api&utm_medium=University+of+Maryland%3A1409618655617| santa baby, slip a sable under the tree, for me i've been an awful good girl santa baby, so hurry down the chimney tonight  santa baby, a  convertible too, light blue  i'll wait up for you dear santa baby, so hurry down the chimney tonight  think of all the fun i've missed think of all the fellas that i haven't kissed next year i could be just as good if you'd check off my christmas list  santa baby, i wanna yacht and really that's not a lot i've been an angel all year santa baby, so hurry down the chimney tonight  santa baby, there's something i really do need, the deed to a platinum mine santa baby, so hurry down the chimney tonight  santa baby, i'm filling my stocking with a duplex, and checks sign your 'x' on the line santa baby, so hurry down the chimney tonight  come and trim my christmas tree with some decorations bought at tiffany's  i really do believe in you let's see if you believe in me  santa baby, forgot to mention one little thing, a ring i don't mean on the phone santa baby, so hurry down the chimney tonight  santa baby, hurry down the chimney tonight santa baby, hurry down the chimney tonight santa baby, hurry tonight|Pop|The Pussycat Dolls|97539|Stickwitu (International Version)|21095791
36|6007152|Qué Hiciste|70|https://www.musixmatch.com/lyrics/Jennifer-Lopez/Come-Over/translation/english?utm_source=application&utm_campaign=api&utm_medium=University+of+Maryland%3A1409618655617| yesterday, we both sounded with a perfect world yesterday, our words were too many words because in the eyes we spied the soul and he did not hesitate in your look  yesterday, we promised to conque the whole world yesterday, you swore me this love would be eternal because once wrong is enough to learn what it is to love sincerely  what did you do? today you destroyed hope with your pride today, you embroiled my look with your fury you erased all our history with your rage and you confused so much love that i gave you as permission to break my soul  what did you do? you forced us to destry the early hours and our nights were erased by your words my illusions finished with your false you forgot that it was love that mattered and with your hands you collapsed our house  tommorow a new day dawns in my universe tommorow i will not see your name written among my verses i will not listen to words of repentance i will ignore without regret your remorse  tommorow i will forgot that yesterday i was your faithful lover tommorow there will not even be reason to hate you i will erase all your dreams from my dreams may the wind drag you memories forever  what did you do? today you destroyed hope with your pride today, you embroiled my look with your fury you erased all our history with your rage and you confused so much love that i gave you with a permit to break my soul  what did you do? you forced us to destry the early hours and our nights were erased by your words y illusions finished with your farces you forgot that it was love that mattered and with your hands you collapsed our house  and you confused so much love that he gave with a permit to break my soul  what did you do? you forced us to destry the early hours and our nights were barred by your words my illusions finished with your farces you forgot that it was love that mattered and with your hands you collapsed our house|Latin|Jennifer Lopez|33491975|Como Ama una Mujer|10725425
37|152158669|Tá Escrito - Ao Vivo|70|https://www.musixmatch.com/lyrics/Grupo-Revela%C3%A7%C3%A3o/T%C3%A1-Escrito-Ao-Vivo/translation/english?utm_source=application&utm_campaign=api&utm_medium=University+of+Maryland%3A1409618655617| in the palm of hand in the palm of hand in the palm of hand in the palm of hand  in the palm of hand in the palm of hand in the palm of hand in the palm of hand  who cultivates the seed of love moves ahead, doesn't freak out when you find bitterness in life it will know to wait your turn  who cultivates the seed of love moves ahead, doesn't freak out when you find bitterness in life it will know to wait your turn  sometimes the happiness takes time to arrive that's when we can't stop dreaming warriors do not run away from the fight and cannot run nobody can stop who was born to win  it's a sunny day but it can turn dark rain only comes when it has to wet in life it's necessary to learn, of you've havested you have to plant it's god who points the star in the palm of hand  hold your head up, step in and go ahead with faith send that sadness away believe a new day will shine your time will come :  hold your head up, step in and go ahead with faith send that sadness away believe a new day will shine your time will come :  who cultivates the seed of love moves ahead, doesn't freak out when you find bitterness in life it will know to wait your turn  who cultivates the seed of love moves ahead, doesn't freak out when you find bitterness in life it will know to wait your turn  sometimes the happiness takes time to arrive that's when we can't stop dreaming warriors do not run away from the fight and cannot run nobody can stop who was born to win  it's a sunny day but it can turn dark rain only comes when it has to wet in life it's necessary to learn, of you've havested you have to plant god points to the star that must shine  hold your head up, step in and go ahead with faith send that sadness away believe a new day will shine your time will come :  hold your head up, step in and go ahead with faith send that sadness away believe a new day will shine your time will come :  hold your head up, step in and go ahead with faith send that sadness away believe a new day will shine your time will come :  hold your head up, step in and go ahead with faith send that sadness away believe a new day will shine your time will come :  hold your head up, step in and go ahead with faith send that sadness away believe a new day will shine your time will come :|Brazilian|Grupo Revelação|46197|Ao Vivo no Morro (Ao Vivo)|29194518
38|136369621|Sexy Mama|70|https://www.musixmatch.com/lyrics/Iyanya-feat-Wizkid/Sexy-Mama?utm_source=application&utm_campaign=api&utm_medium=University+of+Maryland%3A1409618655617| oh yea it's iyanya and your boy wizzy yea yah!!! triple m g  its d' tunes again o hey bah here the ladies at? let's go baby give it to me no delay baby whine for me no dey waste time wizzy baby no shere shebi wizzy baby ati iyanya girl your dance dey make me craze girl your dance dey make maga i'm feeling your sexy waist and d' tunes still the best oh  baby give it to me just go down low pass it to me like ronaldo i got the power come and go anywhere that you go, girl me i'll go yeah keep fronting, i am on to the next when she's with me, her boyfriend na ex and she know we the best where the ladies at? lets go! sexy mama oya ka jo mama ki ya masa mama oya ka jo mama sexy mama oya ka jo mama ki ya masa mama oya ka jo mama see this sexy lady she blow she blow my mind this girl she one of a kind her nyash dey make me maga baby shake it give it to me don't be late gbe sun mo mi, lets relate don't be late, my baby  inside my condo was that your boyfriend? i don't know all the girls them are running helter-skelter them coming to my condo me no talk but she follow it's time leave, she say don't go tonight is out lucky night oya close your eyes for the hmm so she call me spartacus see the things money don cause we young and getting it and that is why all the girls love us  you can chop my money go now as long as you ready to carry go down girl i'm feeling to open now baby baby sexy mama oya ka jo mama ki ya masa mama oya ka jo mama sexy mama oya ka jo mama ki ya masa mama oya ka jo mama sexy mama oya ka jo mama ki ya masa mama oya ka jo mama sexy mama oya ka jo mama ki ya masa mama oya ka jo mama ladies ki ya masa ki ya masa ki ya masa ki ya ma sa ki ya ma sa ki ya ma sa we re we re we re oh ah oh ah ki ya masa ki ya masa ki ya masa ki ya masa ki ya masa ki ya masa we re we re we re oh ah oh ah ki ya masa ki ya masa ki ya masa ki ya masa ki ya masa ki ya masa we re we re we re oh ah oh ah ki ya masa ki ya masa ki ya masa ki ya masa ki ya masa ki ya masa we re we re we re oh ah oh ah  sexy mama oya ka jo mama ki ya masa mama oya ka jo mama sexy mama oya ka jo mama ki ya masa mama oya ka jo mama ki ya masa ki ya masa ki ya masa it's iyanya ki ya masa ki ya masa ki ya masa it's d-tunes again o  yo its your boy wizzy emezy triple m g oh wow two thousand and forever where the ladies at? it's iyanya and d-tunes again|Afro-Beat|Iyanya feat. WizKid|24653968|Sexy Mama|26895046
39|33447619|É Isso Aí (The Blower's Daughter) [Ao Vivo]|70|https://www.musixmatch.com/lyrics/Ana-Carolina-feat-Seu-Jorge/%C3%89-Isso-A%C3%AD-The-Blower-s-Daughter-Ao-Vivo-2/translation/english?utm_source=application&utm_campaign=api&utm_medium=University+of+Maryland%3A1409618655617| that's it how we thought it would be such simple life is good often  that's it the steps go through the streets nobody noticed the moon life always goes on  i do not know how to stop looking at you i do not know how to stop looking at you i will not stop watching you i can not get enough of looking i don't know how to stop to look at you  that's it there are those who believe in miracles some people do evil things some people can not tell the truth  that's it a flower seller teaching his children how to choose their lovers  i do not know how to stop looking at you i do not know how to stop looking at you i will not stop watching you i can not get enough of looking i will not stop to look at you  that's it there are those who believe in miracles some people do evil things some people can not tell the truth  that's it a flower seller teaching his children how to choose their lovers  i do not know how to stop looking at you i do not know how to stop looking at you i will not stop watching you i can not get enough of looking i will not stop to look at you|MPB|Ana Carolina & Seu Jorge|27966023|Ana e Jorge (Ao Vivo)|15452195
40|19738234|The Creeps|70|https://www.musixmatch.com/lyrics/Camille-Jones/The-Creeps?utm_source=application&utm_campaign=api&utm_medium=University+of+Maryland%3A1409618655617| make me take the ride free drinks on tonight take some have a feast break me 'cause it keeps coming  down on either side bleeding in my mind waiting for the creeps to kill my last believes  so come on down to the creeps come on down to the creeps come on  holding back the key fading sanity blowing up my head reaching for my always loving  partner in crime soaking up my mind filling up my glass i'm gone, at last  come on down to the creeps come on down to the creeps come on  walking to the claim the creeps calling my name they get me every-time i'm bleeding and i'm getting  we go split before my eyes increase, double size lease out my brain am i insane  come on down to the creeps come on down to the creeps come on|Pop|Camille Jones|93253|Grandmix 2006|14323151
41|31162780|How to Save a Life|69|https://www.musixmatch.com/lyrics/The-Fray/How-to-Save-a-Life?utm_source=application&utm_campaign=api&utm_medium=University+of+Maryland%3A1409618655617||Rock|The Fray|148806|How to Save a Life|13952135
42|4180869|I Write Sins Not Tragedies|69|https://www.musixmatch.com/lyrics/Panic-At-the-Disco/I-Write-Sins-Not-Tragedies?utm_source=application&utm_campaign=api&utm_medium=University+of+Maryland%3A1409618655617| oh, well imagine as i'm pacing the pews in a church corridor and i can't help but to hear no, i can't help but to hear an exchanging of words  what a beautiful wedding what a beautiful wedding, says a bridesmaid to a waiter and yes, but what a shame what a shame the poor groom's bride is a whore  i chime in with a haven't you people ever heard of closing a goddamn door? no, it's much better to face these kinds of things  with a sense of poise and rationality i chime in, haven't you people ever heard of closing a goddamn door? no, it's much better to face these kinds of things  with a sense of  oh, well in fact well, i'll look at it this way  i mean technically our marriage is saved well this calls for a toast, so pour the champagne oh, well in fact well, i'll look at it this way i mean technically our marriage is saved  well this calls for a toast, so pour the champagne pour the champagne  i chime in with a haven't you people ever heard of  closing a goddamn door? no, it's much better to face these kinds of things with a sense of poise and rationality i chime in, haven't you people ever heard of  closing a goddamn door?  no, it's much better to face these kinds of things with a sense of poise and rationality again i chime in, haven't you people ever heard of closing a goddamn door? no, it's much better to face these kinds of things with a sense of poise and rationality i chime in, haven't you people ever heard of closing a goddamn door? no, it's much better to face these kinds of things with a sense of poise and rationality again|Rock|Panic! At the Disco|135957|A Fever You Can't Sweat Out|10564129
