|track_id|track_name|track_rating|track_url|lyrics|genre|artist_name|artist_id|album_name|album_id
75|144283673|Θες|60|https://www.musixmatch.com/lyrics/%CE%94%CE%B7%CE%BC%CE%AE%CF%84%CF%81%CE%B7%CF%82-%CE%9C%CE%B7%CF%84%CF%81%CE%BF%CF%80%CE%AC%CE%BD%CE%BF%CF%82/%CE%98%CE%B5%CF%82-%CE%AD%CE%BD%CE%B1%CE%BD-%CE%BA%CF%8C%CF%83%CE%BC%CE%BF-%CF%80%CE%B9%CE%BF-%CE%BC%CE%B5%CE%B3%CE%AC%CE%BB%CE%BF/translation/english?utm_source=application&utm_campaign=api&utm_medium=University+of+Maryland%3A1409618655617| you want me to be fine , not to hurt you want to be away and sharing moments that i had kept to have you you want not to telling you i love you to live and forget your perfume you want me never exist in your dreams never hear my heart's voice to hold it a place to hide not to be sad for losing you not to be afraid that our need wins never touch your truth ever again να μην πονέσω με το τέλος με το τέλος που πονά  θες να γίνω άλλος να μην είμαι πια εγώ μέσα στο κόσμο αυτό που έφτιαξες να ζω να'μαι καθρέφτης της δικής σου λογικής που θα σε βλέπει και θα λέει ότι πεις να ψάξω αλλού το άλλο μου μισό αυτό που πάντα μ'άφηνε μισό να'μαι καθρέφτης σε όλα αυτά που εσύ θα θες μα αν το μπορώ ποτέ δεν ρώτησες  θες ότι κακό να το περνάω θες να προσποιούμαι πως γελάω χωρίς να 'σαι κοντά μου να υπάρχω θες δικαιολογίες πάντα να'χω not to be sad for losing you not to be afraid that our need wins never touch your truth ever again να μην πονέσω με το τέλος με το τέλος που πονά  θες να γίνω άλλος να μην είμαι πια εγώ μέσα στο κόσμο αυτό που έφτιαξες να ζω να'μαι καθρέφτης της δικής σου λογικής που θα σε βλέπει και θα λέει ότι πεις να ψάξω αλλού το άλλο μου μισό αυτό που πάντα μ'άφηνε μισό να'μαι καθρέφτης σε όλα αυτά που εσύ θα θες μα αν το μπορώ ποτέ δεν ρώτησες  θες να ψάξω αλλού το άλλο μου μισό αυτό που πάντα μ'άφηνε μισό να'μαι καθρέφτης σε όλα αυτά που εσύ θα θες μα αν το μπορώ ποτέ δεν ρώτησες  you want me to be fine , not to hurt you want to be away and sharing moments that i had kept to have you θες να μη σου λέω πως σ'αγαπάω θες|Pop|Δημήτρης Μητροπάνος|49683|Πες Μου Τ' Αληθινά Σου|27935714
76|3244626|Hey There Delilah|59|https://www.musixmatch.com/lyrics/Plain-White-T-s-2/Hey-There-Delilah?utm_source=application&utm_campaign=api&utm_medium=University+of+Maryland%3A1409618655617| hey there delilah, what's it like in new york city? i'm a thousand miles away, but girl, tonight you look so pretty yes you do times square can't shine as bright as you, i swear it's true  hey there delilah, don't you worry about the distance i'm right there if you get lonely give this song another listen close your eyes listen to my voice, it's my disguise, i'm by your side  oh, it's what you do to me oh, it's what you do to me oh, it's what you do to me oh, it's what you do to me, what you do to me  hey there delilah, i know times are getting hard but just believe me, girl, someday i'll pay the bills with this guitar we'll have it good we'll have the life we knew we would, my word is good  hey there delilah, i've got so much left to say if every simple song i wrote to you would take your breath away i'd write it all even more in love with me you'd fall, we'd have it all  oh, it's what you do to me oh, it's what you do to me oh, it's what you do to me oh, it's what you do to me  a thousand miles seems pretty far but they've got planes and trains and cars i'd walk to you if i had no other way our friends would all make fun of us and we'll just laugh along because we know that none of them have felt this way delilah, i can promise you that by the time we get through the world will never ever be the same, and you're to blame  hey there delilah, you be good and don't you miss me two more years and you'll be done with school and i'll be making history like i do you'll know it's all because of you we can do whatever we want to hey there delilah, here's to you this one's for you  oh, it's what you do to me oh, it's what you do to me oh, it's what you do to me oh, it's what you do to me what you do to me oh-oh, oh-oh, oh-oh-oh, oh-oh oh-oh, oh-oh, oh-oh, oh-oh|Pop Punk|Plain White T's|19211|All That We Needed|10484457
77|46373060|Papa Lolo|59|https://www.musixmatch.com/lyrics/Mose-Fanfan/Papa-Lolo/translation/english?utm_source=application&utm_campaign=api&utm_medium=University+of+Maryland%3A1409618655617| why is is it that the witchdoctors hail witchcraft  when the night fall and becomes dark thats the daytime when the witches praise god  at the sunrise they remove their christianity cocoons to perform witch craft, its amazing  am crying for my mama i'm crying for my papa im crying for my mama i'm crying for my papa  mr lolo eh where did they dump you? mr lolo eh where did they dump you?  instrumental  in this world people never accept anyone never complain that you are getting a raw deal  in this world mind your own business and do what's best people will follow you later remember the river doesn't have a bone  know that you were born in the society for a reason the witch will be always watching you with keen eyes  mr lolo eh where did they dump you? mr lolo eh where did they dump you?  god created the world he created breathe and air, he created life in it  he gave us the breath that you breath today he created the garden of eden for us  whereas he caged us in slavery all the time we have to beg for love saying i love you eeh  mr lolo eh where did they dump you? mr lolo eh where did they dump you?  in this world people never accept anyone never complain that you are getting a raw deal  in this world mind your own business and do what's best people will follow you later remember the river doesn't have a bone  know that you were born in the society for a reason the witch will be always watching you with keen eyes  mr lolo eh where did they dump you? mr lolo eh where did they dump you?  god created the world he created breathe and air, he created life in it  he gave us the breath that you breath today he created the garden of eden for us  whereas he caged us in slavery all the time we have to beg for love saying i love you eeh  mr lolo eh where did they dump you? mr lolo eh where did they dump you?  god created the world he created breathe and air, he created life in it  he gave us the breath that you breath today he created the garden of eden for us  whereas he caged us in slavery all the time we have to beg for love saying i love you eeh  mr lolo eh where did they dump you?  mr lolo eh all the time we have to beg for love saying i love you eeh  mr lolo eh where did they dump you?  mr lolo eh all the time we have to beg for love saying i love you eeh  mr lolo eh where did they dump you?  mr lolo eh all the time we have to beg for love saying i love you eeh  mr lolo eh where did they dump you?  mr lolo eh all the time we have to beg for love saying i love you eeh  mr lolo eh where did they dump you?  mr lolo eh where did they dump you?|World|Mose Fanfan|25989152|Bayekeleye|16361333
78|34248298|Sugar, We're Going Down|58|https://www.musixmatch.com/lyrics/Fall-Out-Boy/Sugar-We-re-Going-Down?utm_source=application&utm_campaign=api&utm_medium=University+of+Maryland%3A1409618655617| am i more than you bargained for yet? i've been dying to tell you anything you want to hear cause that's just who i am this week lie in the grass, next to the mausoleum i'm just a notch in your bedpost but you're just a line in a song a notch in your bedpost, but you're just a line in a song  drop a heart, break a name we're always sleeping in, and sleeping for the wrong team  we're goin' down, down in an earlier round and sugar, we're goin' down swinging i'll be your number one with a bullet a loaded god complex, cock it and pull it  we're goin' down, down in an earlier round and sugar, we're goin' down swinging i'll be your number one with a bullet a loaded god complex, cock it and pull it  is this more than you bargained for yet? oh, don't mind me, i'm watching you two from the closet wishing to be the friction in your jeans isn't it messed up how i'm just dying to be him i'm just a notch in your bedpost but you're just a line in a song notch in your bedpost, but you're just a line in a song  drop a heart, break a name we're always sleeping in, and sleeping for the wrong team  we're goin' down, down in an earlier round and sugar, we're goin' down swinging i'll be your number one with a bullet a loaded god complex, cock it and pull it  we're going down, down in an earlier round and sugar, we're going down swinging i'll be your number one with a bullet a loaded god complex, cock it and pull it  down, down in an earlier round and sugar, we're going down swinging i'll be your number one with a bullet a loaded god complex, cock it and pull it  we're going down, down in an earlier round and sugar, we're going down swinging i'll be your number one with a bullet a loaded god complex, cock it and pull it  we're going down, down down, down down, down down, down we're goin' down, down down, down a loaded god complex, cock it and pull it  we're goin' down, down in an earlier round and sugar, we're goin' down swinging i'll be your number one with a bullet a loaded god complex, cock it and pull it|Rock|Fall Out Boy|48290|From Under the Cork Tree|15514931
79|104317962|2 Bob|58|https://www.musixmatch.com/lyrics/Malaika/2-Bob/translation/english?utm_source=application&utm_campaign=api&utm_medium=University+of+Maryland%3A1409618655617| my love my star the one i want my parents raised me up i've left i'll die with it my  cents  people are asking why does it look like you're walking slowly the sun is setting hurry up baby you're walking slowly  you're not going back you have been taken i will find you ahead you're not going back you have been taken i will find you ahead  x who is this person's lover this person is mine this person is mine  i am not going back i've been taken you will find me ahead i am not going back i have left you will find me ahead  x my love i'll die with him i will die with my lover i have left my parents have raised mr   cents  my  cents i'll die with it my person my star i love you  my  cents i have found my girl men are crying over you my darling you are mine i really love you  i am not going back because i love you my love i am not going back because i love you my love   cents  my love my star my  cents i'll die with it  repeat till fade   cents  my love nisi vaya kiliwu yanga my person my  cents|Pop|Malaika|147264|Vuthelani|22519359
80|19318462|DARE|57|https://www.musixmatch.com/lyrics/Gorillaz/DARE?utm_source=application&utm_campaign=api&utm_medium=University+of+Maryland%3A1409618655617| it's coming up it's coming up it's coming up it's coming up it's coming up it's coming up it's dare  it's dare  you've got to press it on you you've just been thinking that's what you do, baby hold it down, dare  jump with them all and move it jump back and forth it feels like you were there yourself, work it out  never did no harm never did no harm it's dare it's coming up it's coming up it's coming up it's coming up it's coming up it's dare it's dare  you've got to press it on you you've just been thinking that's what you do, baby hold it down, dare  jump with them all and move it jump back and forth it feels like you were there yourself, work it out  never did no harm never did no harm it's dare it's coming up it's coming up it's coming up it's coming up it's coming up it's dare  never did no harm never did no harm it's dare it's coming up it's coming up it's coming up it's coming up it's coming up it's dare  you've got to press it on you you've just been thinking that's what you do, baby hold it down, dare  jump with them all and move it jump back and forth it feels like you were there yourself, work it out  you've got to press it on you you've just been thinking that's what you do, baby hold it down, dare  jump with them all and move it jump back and forth it feels like you were there yourself, work it out|Hip Hop/Rap|Gorillaz|8891|Demon Days|10714380
81|3650839|Noviembre Sin Ti|57|https://www.musixmatch.com/lyrics/Reik/Noviembre-Sin-Ti/translation/english?utm_source=application&utm_campaign=api&utm_medium=University+of+Maryland%3A1409618655617| afternoon gets away, the sky is gray the night appears without you quiet on the beach i cry for you in silence again  this pity drowns me, i can't live the waves don't tell me about you sitting on the sand, i write your name again  because i miss you since that november when we dreamed together to love eachother forever it hurts me, this cold november when the leaves fall to die forever  november without you is feeling that rain tells me crying that everything is over november without you is asking for the moon to shine at the night of my heart again, again again  i would like to tell you i want to comeback your name is written on my skin it's already dawn i'm still waiting for you once again  because i miss you since that november when we dreamed together to love eachother forever it hurts me, this cold november when the leaves fall to die forever  november without you is feeling that rain tells me crying that everything is over november without you is asking for the moon to shine at the night of my heart again, again again  november without you is feeling that rain tells me crying that everything is over november without you is asking for the moon to shine at the night of my heart again, again again|Pop in Spanish|Reik|139712|Reik|10519016
82|80627181|When I'm Gone|57|https://www.musixmatch.com/lyrics/Eminem/When-I-m-Gone?utm_source=application&utm_campaign=api&utm_medium=University+of+Maryland%3A1409618655617| yeah it's my life in my own words, i guess  have you ever loved someone so much you'd give an arm for? not the expression no, literally give an arm for when they know they're your heart and you know you were their armor and you will destroy anyone who would try to harm her but what happens when karma turns right around and bites you and everything you stand for turns on you despite you what happens when you become the main source of pain  daddy look what i made dad's gotta go catch a plane daddy where's mommy? i can't find mommy, where is she? i don't know, go play, hailie, baby, your daddy's busy daddy's writin' a song, the song ain't gon' write itself i'll give you one underdog, then you got to swing by yourself  then turn right around in that song and tell her you love her and put hands on her mother, who's a spittin' image of her that's slim shady yeah, baby, slim shady's crazy shady made me, but tonight, shady's rock-a-bye-baby, huh  and when i'm gone, just carry on don't mourn, rejoice everytime you hear the sound of my voice just know that, i'm lookin' down on you smilin' and i didn't feel a thing, so baby don't feel no pain, just smile back  and when i'm gone, just carry on don't mourn, rejoice everytime you hear the sound of my voice just know that, i'm lookin' down on you smilin' and i didn't feel a thing, so baby don't feel no pain, just smile back  i keep havin' this dream i'm pushin' hailie on the swing she keeps screamin', she don't want me to sing you're makin' mommy cry why? why is mommy cryin'? baby, daddy ain't leavin' no more daddy you're lyin' you always say that, you always say this is the last time but you ain't leavin' no more, daddy you're mine she's pilin' boxes in front of the door tryin' to block it daddy please, daddy don't leave, daddy, no, stop it goes in her pocket, pulls out a tiny necklace locket, it's got her picture this'll keep you safe daddy, take it with ya i look up, it's just me standin' in the mirror these fuckin' walls must be talkin' 'cause man i can hear 'em they're sayin' you got one more chance to do right and it's tonight now go out there and show 'em that you love 'em 'fore it's too late and just as i go to walk out of my bedroom door it turns to a stage they're gone, and the spotlight is on and i'm singin'  and when i'm gone, just carry on don't mourn, rejoice everytime you hear the sound of my voice just know that, i'm lookin' down on you smilin' and i didn't feel a thing, so baby don't feel no pain, just smile back  and when i'm gone, just carry on don't mourn, rejoice everytime you hear the sound of my voice just know that, i'm lookin' down on you smilin' and i didn't feel a thing, so baby don't feel no pain, just smile back  sixty thousand people, all jumpin' out their seats the curtain closes, they're throwin' roses at my feet i take a bow and thank you all for comin' out they're screamin' so loud i'll take one last look at the crowd i glance down, i don't believe what i'm seein' daddy it's me, help mommy, her wrists are bleedin' but baby we're in sweden, how did you get to sweden? i followed you daddy, you told me that you weren't leavin' you lied to me dad, and now you made mommy sad and i bought you this coin, it says 'number one dad' that's all i wanted, i just want to give you this coin i get the point, fine, me and mommy are goin' but baby, wait! it's too late, dad, you made the choice now go out there and show 'em that you love 'em more than us that's what they want, they want you marshall they keep screamin' your name, it's no wonder you can't go to sleep just take another pill, yeah, i bet that you will you rap about it yeah, word, k-k-keep it real i hear applause, all this time i couldn't see how could it be that the curtain is closin' on me? i turn around, find a gun on the ground, cock it put it to my brain, scream die, shady! and pop it the sky darkens, my life flashes the plane that i was supposed to be on crashes and burns to ashes that's when i wake up, alarm clocks ringin' there's birds singin' it's spring and hailie's outside swingin' i walk right up to kim and kiss her, tell her i miss her hailie just smiles and winks at her little sister almost as if to say  and when i'm gone, just carry on don't mourn, rejoice everytime you hear the sound of my voice just know that, i'm lookin' down on you smilin' and i didn't feel a thing, so baby don't feel no pain, just smile back  and when i'm gone, just carry on don't mourn, rejoice everytime you hear the sound of my voice just know that, i'm lookin' down on you smilin' and i didn't feel a thing, so baby don't feel no pain just smile back|Hip Hop/Rap|Eminem|426|When I'm Gone|20496119
83|34026388|Bird Guhl|57|https://www.musixmatch.com/lyrics/Antony-The-Johnsons/Bird-Guhl?utm_source=application&utm_campaign=api&utm_medium=University+of+Maryland%3A1409618655617| i am bird girl i am bird girl i am bird girl i am a bird girl now i've got my heart here in my hands now i've got my heart here in my hands now i've been searching for my wings some time i've been searching for my wings some time i'm gonna be born i'm gonna be born into soon the sky i'm gonna be born into soon the sky 'cause i'm a bird girl and the bird girls go to heaven i'm a bird girl and the bird girls can fly bird girls can fly bird girls can fly bird girls can fly|Alternative|Antony & The Johnsons|34248742|I Am a Bird Now|15497913
84|3650838|Yo Quisiera|56|https://www.musixmatch.com/lyrics/Reik/Yo-Quisiera/translation/english?utm_source=application&utm_campaign=api&utm_medium=University+of+Maryland%3A1409618655617| i'm your best friend, your shoulder to cry on of lost loves  you lay in my arm your crying doesn't cease i only caress you  y me dices ¿por qué la vida es tan cruel con tus sentimientos? i just hug you, and i comfort you you ask me for a thousand advices to protect you from your next meeting, you know i look after you  lo que no sabes es i would like to be the one for whom you sleepless and despair i would like to be your crying that comes from your feelings i would like to be the one for whom you would wake up excited i would like you to live with me always in love  oh-oh-oh-oh, uh-uh aoh, no, no, no, uh-uh  you stare at me and ask me if something is wrong with me and i don't know what to do  if you knew that i'm dying i would like to tell you what i feel no no nooo but i am afraid that you will reject me and that only in my mind you live forever  that's why i would like to be the one for whom you unveil and despair i would like to be your crying that comes from your feelings i would like to be the one for whom you would wake up excited i would like you to live with me always in love  yo quisiera ser yo quisiera ser tu llanto tu vida no, oh-oh-oh yo quisiera ser yo, oh, quisiera ser tu llanto, mmh-mmh, tu vida oh-oh-oh yo quisiera, quisiera uh-ah tu llanto, tu vida uh-ah-ah-ah, ser tu vida, no-oh-oh yo quisiera ser tu llanto, tu vida mmh, llanto, tu vida uh-uh-uh-uh-uh|Pop in Spanish|Reik|139712|Reik|10519016
85|5373629|The Kill|55|https://www.musixmatch.com/lyrics/30-Seconds-To-Mars/The-Kill?utm_source=application&utm_campaign=api&utm_medium=University+of+Maryland%3A1409618655617| what if i wanted to break laugh it all off in your face what would you do  what if i fell to the floor couldn't take this anymore what would you do, do, do  come, break me down bury me, bury me i am finished with you  what if i wanted to fight beg for the rest of my life what would you do, do  you say you wanted more what are you waiting for i'm not running from you  come, break me down bury me, bury me i am finished with you  look in my eyes you're killing me, killing me all i wanted was you  i tried to be someone else but nothing seemed to change i know now, this is who i really am inside finally found myself fighting for a chance i know now, this is who i really am  come, break me down bury me, bury me i am finished with you, you, you look in my eyes you're killing me, killing me all i wanted was you  come, break me down break me down break me down  you say you wanted more what if i wanted to break? what are you waiting for? i'm not running from you what if i, what if i, what if i, what if i bury me, bury me|Rock|Thirty Seconds to Mars|24429260|A Beautiful Lie|10668275
86|4195139|Far Away|55|https://www.musixmatch.com/lyrics/Nickelback/Far-Away?utm_source=application&utm_campaign=api&utm_medium=University+of+Maryland%3A1409618655617| this time, this place misused, mistakes too long, too late who was i to make you wait?  just one chance, just one breath just in case there's just one left 'cause you know, you know, you know  that i love you i have loved you all along and i miss you been far away, for far too long  i keep dreaming you'll be with me and you'll never go stop breathing if i don't see you anymore  on my knees, i'll ask last chance for one last dance 'cause with you; i'd withstand all of hell to hold your hand  i'd give it all; i'd give for us give anything, but i won't give up 'cause you know, you know, you know  that i love you i have loved you all along and i miss you been far away, for far too long  i keep dreaming you'll be with me and you'll never go stop breathing if i don't see you anymore  so far away, so far away been far away, for far too long so far away, so far away been far away, for far too long  but you know, you know, you know i wanted, i'd wanted you to stay 'cause i needed i need to hear you say  that i love you that i love you i have loved you all along and i forgive you and i forgive you for being away, for far too long  so keep breathing 'cause i'm not leaving you anymore believe it hold on to me and never let me go  keep breathing 'cause i'm not leaving you anymore believe it hold on to me and never let me go  keep breathing hold on to me and never let me go keep breathing hold on to me and never let me go|Rock|Nickelback|7400|All the Right Reasons|10565367
