|track_id|track_name|track_rating|track_url|lyrics|genre|artist_name|artist_id|album_name|album_id
62|149073946|Psycho (feat. Ty Dolla $ign)|80|https://www.musixmatch.com/lyrics/Post-Malone-feat-Ty-Dolla-ign/Psycho-feat-Ty-Dolla-ign?utm_source=application&utm_campaign=api&utm_medium=University+of+Maryland%3A1409618655617| damn, my ap goin' psycho, lil' mama bad like michael can't really trust nobody with all this jewelry on you my roof look like a no-show, got diamonds by the boatload come with the tony romo for clowns and all the bozos my ap goin' psycho, lil' mama bad like michael can't really trust nobody with all this jewelry on you my roof look like a no-show, got diamonds by the boatload don't act like you my friend when i'm rollin' through my ends, though  you stuck in the friend zone, i tell that four-five the fifth, ayy hunnid bands inside my shorts, dechino the shit, ayy try to stuff it all in, but it don't even fit, ayy know that i been with the shits ever since a jit, ayy i made my first million, i'm like, shit, this is it, ayy  for a walkthrough, man, we had that bitch lit, ayy had so many bottles, gave ugly girl a sip out the window of the benzo, we get seen in the rent' and i'm like whoa, man, my neck so goddamn cold diamonds wet, my t-shirt soaked i got homies, let it go, oh my money thick, won't ever fold she said, can i have some to hold? and i can't ever tell you no  damn, my ap goin' psycho, lil' mama bad like michael can't really trust nobody with all this jewelry on you my roof look like a no-show, got diamonds by the boatload come with the tony romo for clowns and all the bozos my ap goin' psycho, lil' mama bad like michael can't really trust nobody with all this jewelry on you my roof look like a no-show, got diamonds by the boatload don't act like you my friend when i'm rollin' through my ends, though  the ap goin' psycho, my rollie goin' brazy i'm hittin' lil' mama, she wanna have my babies it's fifty on the pinky, chain so stanky you should see the whip, promise i can take yo' bitch dolla ridin' in an old school chevy, it's a drop top boolin' with a thot-thot, she gon' give me top-top just one switch, i can make the ass drop hey uh, take you to the smoke shop we gon' get high, ayy, we gon' hit rodeo dial up valentino, we gon' hit pico take you where i'm from, take you to the slums this ain't happen overnight, no, these diamonds real bright saint laurent jeans, still in my vans though all vvs', put you in a necklace girl, you look beautiful tonight stars on the roof, they matching with the jewelry  damn, my ap goin' psycho, lil' mama bad like michael can't really trust nobody with all this jewelry on you my roof look like a no-show, got diamonds by the boatload come with the tony romo for clowns and all the bozos my ap goin' psycho, lil' mama bad like michael can't really trust nobody with all this jewelry on you my roof look like a no-show, got diamonds by the boatload don't act like you my friend when i'm rollin' through my ends, though|Pop|Post Malone|28444515|beerbongs & bentleys|28689059
63|158893107|Solo (feat. Demi Lovato)|80|https://www.musixmatch.com/lyrics/Clean-Bandit-feat-Demi-Lovato/Solo?utm_source=application&utm_campaign=api&utm_medium=University+of+Maryland%3A1409618655617| it-solo, solo, everybody it-solo, e-e-everybody it-solo, solo, everybody woop, woop, woop, woop, woop, woop, woop  i never meant to leave you hurtin' i never meant to do the worst thing not to you s-solo, solo, everybody  'cause every time i read your message i wish i wasn't one of your exes now i'm the fool s-solo, solo, everybody  since you been gone been dancing on my own there's boys up in my zone, but they can't turn me on 'cause baby, you're the only one i'm coming for i can't take no more, no more, no more  i wanna f-woop-woop-woop, but i'm broken hearted cr-cr-cry, but i like to party t-t-touch, but i got nobody here on my own  i wanna f-woop-woop-woop, but i'm broken hearted cr-cr-cry, since the day we parted t-t-touch, but i got nobody so, i do it solo  it-solo, solo, everybody it-solo, e-e-everybody it-solo, solo, everybody i do it solo  it-solo, solo, everybody it-solo, e-e-everybody it-solo, solo, everybody i do it solo  every single night i lose it i can't even hear the music without you s-solo, solo, everybody ah, yeah, yeah, yeah  try to stop myself from callin' but i really wanna know if you're with someone new s-solo, solo, everybody  since you been gone i've been dancing on my own there's boys up in my zone, but they can't turn me on 'cause baby, you're the only one i'm coming for i can't take no more, no more, no more  i wanna f-woop-woop-woop, but i'm broken hearted cr-cr-cry, but i like to party t-t-touch, but i got nobody here on my own  i wanna f-woop-woop-woop, but i'm broken hearted cr-cr-cry, since the day we parted t-t-touch, but i got nobody so, i do it solo  it-solo, solo, everybody it-solo, e-e-everybody it-solo, solo, everybody i do it solo  it-solo, solo, everybody it-solo, e-e-everybody it-solo, solo, everybody i do it solo  can't do it solo  i wanna f-woop-woop-woop, but i'm broken hearted cr-cr-cry, but i like to party t-t-touch, but i got nobody here on my own here on my own  i wanna f-woop-woop-woop, but i'm broken hearted cr-cr-cry, since the day we parted t-t-touch, but i got nobody so, i do it solo  it-solo, solo, everybody it-solo, e-e-everybody it-solo, solo, everybody i do it solo it-solo, e-e-everybody  it-solo, solo, everybody it-solo, e-e-everybody it-solo, solo, everybody i do it solo  so, i do it solo|Dance|Clean Bandit|14377067|What Is Love?|30223636
64|159555406|Better|80|https://www.musixmatch.com/lyrics/Khali-D/Better?utm_source=application&utm_campaign=api&utm_medium=University+of+Maryland%3A1409618655617| nothing feels better i'm not really drunk, i never get that fucked up i'm not, i'm so sober!  i love to see you shine in the night like the diamond you are i'm good on the side, it's alright just hold me in the dark  no one's gotta know what we do hit me up when you're bored 'cause i live down the street, so we meet when you need it, it's yours all i hear is  nothing feels better than this nothing feels better nothing feels better than this nothing feels better, oh, nah  we don't gotta hide this is what you like, i admit nothing feels better than this  you say we're just friends, but i swear when nobody's around you keep my hand around your neck, we connect are you feeling it now?  'cause i am i got so high the other night, i swear to god felt my feet lift the ground ooh, yeah your back against the wall, this is all you've been talkin' about in my ears  nothing feels better than this nothing feels better nothing feels better than this nothing feels better, oh, nah  we don't gotta hide this is what you like, i admit nothing feels better than this  now, left, right, left, right take it back, bring it side to side like that, like that, ayy ooh, now, left, right, left, right take it back, bring it side to side like–  nothing feels better than this nothing feels better nothing feels better than this nothing feels better, oh, nah  we don't gotta hide this is what you like, i admit nothing feels better than this  better than this  nothing feels better than this oh yeah|R&B/Soul|Khalid|32569774|Suncity|30352052
65|178285666|Taki Taki|80|https://www.musixmatch.com/lyrics/DJ-Snake-feat-Selena-Gomez-Ozuna-Cardi-B-2/Taki-Taki/translation/english?utm_source=application&utm_campaign=api&utm_medium=University+of+Maryland%3A1409618655617| wooh, oh-oh  dance for me like it's the last time and show me that little step that i do not know a nice little kiss, baby taki taki taki taki ¡rui mas  wo-oh, oh-oh hi music  hi flow snake  dance for me like it's the last time and show me that little step that i do not know a nice little kiss, baby taki taki taki taki  taki taki he wants a little kiss or a nut booty explodes as nagasaki turn on the kawasaki engines that the club is full and the anunnakis came don't stop  the booty sticks out of your suit she did not bring pαnties so the guy doesn't have to work for it it's just that i know what she thinks she knows she says she doesn't want to but she is spying on me, eh-eh  the booty sticks out of your suit she did not bring pαnties so the guy doesn't have to work for it it's just that i know what she thinks she knows she says she doesn't want to but she is spying on me, eh-eh  dance for me like it's the last time and show me that little step that i do not know a nice little kiss, baby taki taki, taki taki, party!  wo-oh, oh-oh hi music hi flow  bardi cardi el me dijo que quiere tocarlo, jugar con él y apretarlo bueno, mi alcancía tiene hambre, mi negro, necesitas alimentarla si el texto no es raro, no quiero leerlo y para que lo sepan, esta vgina está invicta  aye dijo que realmente quiere verme más dije que deberíamos tener una cita, ¿dónde? en la tienda lamborghini soy aterradora, difícil de leer, soy como una tabla de ouija pero soy la jefa, perra, por quién quieres dejarme?  ustedes putas no tienen clase, ustedes putas siguen sin dinero habló de efectivo, mierda, mientras hago estallar mi parrilla de oro soy una perra muy rica, y trabajo como si fuera pobre pero el amor es tan falso, y el odio tan real  the booty sticks out of my suit i did not wear underwear so he doesn't have to work for it is just that i know what you think you do not know he says he does not want to, but you want to eat the luggage  dance for me like it's the last time and show me that little step that i do not know a nice little kiss, baby taki taki, taki taki ¡party! wo-oh, oh-oh  dj snake cuidado cuando vienes por mi camino mi cuerpo-po sabe cómo jugar lo trabajo, lo mantengo apretado todos los días y yo, yo, yo sé que necesitas una probada cuando yo ooo, tú te estás enamorando da un pequeño ooo-ooo, hazlo bien hecho bailando en mi ooo, hago que tu chica quiera correr seguimos moviéndonos hasta que salga el sol  because yo soy fiesta i'm the party apaga tus velas luego toma una siesta pueden intentarlo, pero nadie puede detenerme lo que mi taki taki quiere, ya mi taki taki lo consigue, uhn  dance for me like it's the last time and show me that little step that i do not know a nice little kiss, baby taki taki taki taki ¡rui mas wo-oh, oh-oh  hi music hi flow taki taki taki taki|Pop|DJ Snake feat. Selena Gomez, Ozuna & Cardi B|36876732|Carte Blanche|33738847
66|161600431|Nothing Breaks Like a Heart|80|https://www.musixmatch.com/lyrics/Mark-Ronson-feat-Miley-Cyrus/Nothing-Breaks-Like-a-Heart?utm_source=application&utm_campaign=api&utm_medium=University+of+Maryland%3A1409618655617| this world can hurt you it cuts you deep and leaves a scar things fall apart, but nothing breaks like a heart and nothing breaks like a heart  i heard you on the phone last night we live and die by pretty lies you know it, oh, we both know it these silver bullet cigarettes this burning house, there's nothing left  it's smoking, we both know it we got all night to fall in love but just like that we fall apart we're broken, we're broken  mmm, well nothing, nothing, nothing gon' save us now  well, there's broken silence by thunder crashing in the dark crash in the dark and this broken record spin endless circles in the bar  spin 'round in the bar this world can hurt you it cuts you deep and leaves a scar things fall apart, but nothing breaks like a heart mhmm, and nothing breaks like a heart  we'll leave each other cold as ice and high and dry, the desert wind is blowing, is blowing remember what you said to me? we were drunk in love in tennessee and i hold it, we both know it  mmm, nothing, nothing, nothing gon' save us now nothing, nothing, nothing gon' save us now  well, there's broken silence by thunder crashing in the dark crash in the dark and this broken record spin endless circles in the bar spin 'round in the bar  this world can hurt you it cuts you deep and leaves a scar things fall apart, but nothing breaks like a heart mhmm, and nothing breaks like a heart nothing breaks like a heart mhmm, and nothing breaks like a heart  my heart, my heart nothing, nothing, nothing gon' save us now my heart, my heart nothing, nothing, nothing gon' save us now  well, there's broken silence by thunder crashing in the dark crash in the dark and this broken record spin endless circles in the bar  spin 'round in the bar this world can hurt you it cuts you deep and leaves a scar things fall apart, but nothing breaks like a heart  mhmm, but nothing breaks like a heart but nothing breaks like a heart mhmm, but nothing breaks like a heart|Pop|Mark Ronson feat. Miley Cyrus|37242102|Nothing Breaks Like a Heart (feat. Miley Cyrus)|30729778
67|154277207|My Only One (No Hay Nadie Más)|80|https://www.musixmatch.com/lyrics/Sebastian-Yatra-feat-Isabela-Moner/My-Only-One-No-Hay-Nadie-M%C3%A1s?utm_source=application&utm_campaign=api&utm_medium=University+of+Maryland%3A1409618655617| i remember when i met you i didn't wanna fall felt my hands were shaking 'cause you looked so beautiful  i remember when you kissed me i knew you were the one oh, my hands were shaking when you played my favourite song  i don't know why, but every time i look into your eyes i see a thousand falling shooting stars and yes i love you i can't believe that every night you're by my side  promise i'll stay here 'til the morning and pick you up, when you're falling when the rain gets rough when you've had enough i'll just sweep you off your feet and fix you with my love my only one my only one  tell me how you do it i can barely breathe with the smile you get you get the best of me and all i really want is to give you is all of me  tell me how you do it, how you bring me back you bring me back to life then make my heartbeat stop i can't take it  i don't know why, but every time i look into your eyes i see a thousand falling shooting stars and yes i love you i can't believe that every night you're by my side  voy a cuidarte por las noches voy a amarte sin reproches te voy a extrañar en la tempestad y aunque existan mil razones para renunciar  promise i'll stay here 'til the morning and pick you up when you're falling when the rain gets rough when you've had enough i'll just sweep you off your feet and fix you with my love my only one  there's no one else my only one there's no one else you are my only one it's just there's no one else oh oh, my only one my only|Pop in Spanish|Sebastian Yatra feat. Isabela Moner|36421047|My Only One (No Hay Nadie Más)|29498772
68|159269349|All I Am|80|https://www.musixmatch.com/lyrics/Jess-Glynne/All-I-Am?utm_source=application&utm_campaign=api&utm_medium=University+of+Maryland%3A1409618655617| every butterfly i get belongs to you you don't believe me, but it's true sure, the freckles on my arm spell out your name real feelings coming through  'cause all i know and all i am is you yeah, all i know and all i am is you i'm breaking my silence 'cause i've had a few i just can't deny it that all i know and all i am is you  every time i think i'm falling i know you're falling too there's no doubt you're all in if you ever think you're falling you know i'll catch you too 'cause all i am is you  every daydream i have starts and ends with you i wanna play it one more time when i need an alibi, you're my perfect excuse you are always on my side  'cause all i know and all i am is you i'm breaking my silence 'cause i've had a few i just can't deny it that all i know and all i am is you  every time i think i'm falling i know you're falling too there's no doubt you're all in if you ever think you're falling you know i'll catch you too all i am is you  it feels like i'm miles away you bring me back home again you hold me through my mistakes let go as we start again you're a habit i'll never break no no, no no, no  i'm breaking my silence 'cause i've had a few i just can't deny it oh, no that all i know and all i am is you  every time i think i'm falling i know you're falling too there's no doubt you're all in if you ever think you're falling you know i'll catch you too all i am, oh 'cause all i know and all i am is you yeah, all i know and all i am is you 'cause all i know and all i am is you yeah, all i know and all i am is you|House|Jess Glynne|33490832|Always In Between (Deluxe)|30295617
69|160082405|Le coach (feat. Vincenzo)|80|https://www.musixmatch.com/lyrics/Soprano-feat-Vincenzo/Le-coach/translation/english?utm_source=application&utm_campaign=api&utm_medium=University+of+Maryland%3A1409618655617| eh ouh nananana ouh nananana it's time to push, we have dreams to lift your weight scale is not happy you need to eliminate you must to suffer to be beautiful and not to be photoshopped don't stop when you suffer but rather when you gave everything yes gave everything always get up again and again forbidden to give up, hey hey hey hey  you must work on the cardio to better endure you must work the abs to better endure life is hard, yeah, yeah, yeah life is hard  it's time to push, we have dreams to lift go, go, go, go you need to get up, it's in the head, we're together, we're going to get it go, go, go, go there are only men, there are only warriors there are only men, there are only warriors there are only men, there are only warriors tah men  we are ready for war, we did not come to desert don't tell me false excuses, my patience has no more money prove to me that you are a machine by chaining splits don't stop when you suffer but rather when you gave everything yes gave everything always get up you've already done the hard part so you can not give up, hey, hey, hey, hey  you must work on the cardio to better endure you must work the abs to better endure life is hard, yeah, yeah, yeah life is hard  it's time to push, we have dreams to lift go, go, go, go let's go in the head, we're together we'll go there go, go, go, go  abs, dips, pump, bare abs, dips, pump, bare chained squats chained squats chained squats, squats, squats abs, dips, pump, bare abs, dips, pump, bare hit the bag hit the bag hit the bag, bag, bag go go get the time hastag go to take the chrono all together at the finish line all together at the finish line we will type the cardio we will type the cardio we will gave everything you will know who is the coach  you must work on the cardio to better endure you must work the abs to better endure life is hard, yeah, yeah, yeah life is hard  it's time to push, we have dreams to lift go, go, go, go let's go in the head, we're together we'll go go, go, go, go abs, dips, pump, bare abs, dips, pump, bare go, go, go, go abs, gyps, pump, bare abs, dips, pump, bare go, go, go, go go, stop for  seconds and we do it again|Hip Hop/Rap|Soprano|33492026|Phoenix|30453880
70|180834910|Da Law Etsab|80|https://www.musixmatch.com/lyrics/Amr-Diab/Da-Law-Etsab/translation/english?utm_source=application&utm_campaign=api&utm_medium=University+of+Maryland%3A1409618655617| if i left her no like that my nerves can't handle it any more if i left her one night two nights i will live in torture so, what i can do? in two minutes she killed me and take my eyes oh night, oh eye no this is madness this is not impress so, what i can do? if i left her no like that my nerves can't handle it any more if i left her one night two nights i will live in torture so, what i can do? in two minutes she killed me and take my eyes oh night, oh eye no this is madness this is not impress no one ever took over me like this she taked me a bit by a bit some things could never be hidden between two lovers no one ever took over me like this she taked me a bit by a bit some things could never be hidden between two lovers there is alot of things i have for my babe and kidness without payment so, what i can do? if i left her no like that my nerves can't handle it any more if i left her one night two nights i will live in torture so, what i can do? music tonight, up high a moon passed by and out of so much passion it pulled me towards it when i come near her i recovered so, what i can do? who is responsible about what happened to me someone tell me this is so much the happiness is on arrival no one ever took over me like this she taked me a bit by a bit some things could never be hidden between two lovers no one ever took over me like this she taked me a bit by a bit some things could never be hidden between two lovers there is passion for my love and kindness for no limits oh, what can i do? if i left her no like that my nerves can't handle it any more if i left her one night two nights i will live in torture so, what i can do? in two minutes she killed me and take my eyes oh night, oh eye no this is madness this is not impress|World|Amr Diab|24432616|Kol Hayaty|34211992
71|169444388|Desconocidos|79|https://www.musixmatch.com/lyrics/Mau-y-Ricky-feat-Manuel-Turizo-Camilo/Desconocidos/translation/english?utm_source=application&utm_campaign=api&utm_medium=University+of+Maryland%3A1409618655617| we're just two strangers wanting to kiss wanting that whatever happens we are only two we are only two strangers with fear of falling in love afraid that whatever happens  let's have a good time if you want, then we fall in love let's have a good time step by step, let's screw it let's have a good time yes if you want, then we fall in love let's have a good time step by step, let's screw it  hey, hey, hear me well you are what i look for in a woman i have you in my sights since i arrived i feel that you're mine, i don't know why oh, i know it's a lie say that i am the man of your life if you did not know me yesterday and you did not know you loved me  let's have a good time if you want, then we fall in love let's have a good time step by step, let's screw it vamo 'to have a good time awhile if you want, then we fall in love let's have a good time step by step, let's screw it  and i dance it 'lentico i do not know how to explain what i am seeing in you i love how you are moving your body stars against my body, ma i do not get it tell me if you were hiding from me you so beautiful and i barely knowing you let's dance no matter who is watching today i want to have you with me, with me i want to have fun with you, with you today i want to have you with me, with me and watch the sunrise with you, with you  we're just two strangers wanting to kiss with fear of falling in love wanting that whatever happens we are just two strangers with fear of falling in love wanting to kiss afraid that whatever happens  let's have a good time if you want, then we fall in love let's have a good time step by step, let's screw it let's have a good time yes if you want, then we fall in love let's have a good time step by step, let's screw it  mau and ricky camilo manuel turizo julian turizo|Pop in Spanish|Mau y Ricky feat. Manuel Turizo & Camilo|36970630|Para Aventuras y Curiosidades|32298160
72|162406481|Te Vi|79|https://www.musixmatch.com/lyrics/Piso-21-feat-Micro-Tdh/Te-Vi/translation/english?utm_source=application&utm_campaign=api&utm_medium=University+of+Maryland%3A1409618655617| thd piso  micro tdh pisi  ovy on the drums oh no ovy on the drums  i don't know what's in your look, could it be the way you dance? when we kiss, we feel that we like each other and when i have you in my arms, the time, flies by  and when i saw you, i saw you, i saw you, i saw you i saw you i fell in love immediately, that was on the spot and now that you're here, here, here i want to make you have a good time, the best of times  and when i saw you, i saw you, i saw you, i saw you no i fell in love immediately yeeh that was on the spot now that you're here, here, here baby i want to make you have a good time, the best of times  we gave ourselves a couple of kisses and nothing has happened i just wanted to know if you liked me when you laughed, i loved it and like a crazy, i was lost in your gaze that kiss that we gave ourselves at night while you were dancing are things that i didn't expect it, i felt that you liked me  you have the formula and the activity, huh give me a spin and start to dance, huh i like you so much, that if you go away i get nervous and i start to shake they no longer interest me, mami the other girls move that hot body and get closer to me, to me to me  and when i saw you, i saw you, i saw you, i saw you ouh-no i fell in love immediately, that was on the spot and now that you're here, here, here i want to make you have a good time, the best of times  and when i saw you, i saw you, i saw you, i saw you noo i fell in love immediately yeh that was on the spot now that you're here, here, here baby i want to make you have a good time, the best of times wooh  i don't know what's in your look, could it be the way you dance? when we kiss, we feel that we like each other and when i hold you in my arms the time, flies by  you have the formula and the activity, huh give me a spin and start to dance, huh i like you so much, that if you go away i get nervous and i start to shake i'm not interested in the other girls anymore move that hot body and get closer to me, to me  and when i saw you, i saw you, i saw you, i saw you i fell in love immediately, that was on the spot and now that you're here, here, here i want to make you have a good time, the best of times  and when i saw you, i saw you, i saw you, i saw you noo i fell in love immediately yeeh that was on the spot now that you're here, here, here baby i want to make you have a good time, the best of times|Pop in Spanish|Piso 21 feat. Micro Tdh|37333712|Te Vi|30873157
